tcpdump: verbose output suppressed, use -v or -vv for full protocol decode
listening on wlan0, link-type EN10MB (Ethernet), capture size 262144 bytes
18:32:36.323901 IP ip-192-168-1-10.us-west-2.compute.internal.51600 > api-den.smoot.apple.com.https: Flags [P.], seq 2253099168:2253099199, ack 3037539555, win 2048, options [nop,nop,TS val 253584913 ecr 2701007735], length 31
18:32:36.323915 IP ip-192-168-1-10.us-west-2.compute.internal.51600 > api-den.smoot.apple.com.https: Flags [F.], seq 31, ack 1, win 2048, options [nop,nop,TS val 253584914 ecr 2701007735], length 0
18:32:36.365359 IP api-den.smoot.apple.com.https > ip-192-168-1-10.us-west-2.compute.internal.51600: Flags [P.], seq 1:32, ack 31, win 61, options [nop,nop,TS val 2701008850 ecr 253584913], length 31
18:32:36.365551 IP api-den.smoot.apple.com.https > ip-192-168-1-10.us-west-2.compute.internal.51600: Flags [F.], seq 32, ack 32, win 61, options [nop,nop,TS val 2701008850 ecr 253584914], length 0
18:32:36.366123 IP ip-192-168-1-10.us-west-2.compute.internal.51605 > api-den.smoot.apple.com.https: Flags [SEW], seq 12110196, win 65535, options [mss 1460,nop,wscale 6,nop,nop,TS val 253584972 ecr 0,sackOK,eol], length 0
18:32:36.370144 IP ip-192-168-1-10.us-west-2.compute.internal.51606 > api-den.smoot.apple.com.https: Flags [SEW], seq 3607473551, win 65535, options [mss 1460,nop,wscale 6,nop,nop,TS val 253584976 ecr 0,sackOK,eol], length 0
18:32:36.376174 IP ip-192-168-1-10.us-west-2.compute.internal.51600 > api-den.smoot.apple.com.https: Flags [R], seq 2253099199, win 0, length 0
18:32:36.376530 IP ip-192-168-1-10.us-west-2.compute.internal.51600 > api-den.smoot.apple.com.https: Flags [R], seq 2253099200, win 0, length 0
18:32:36.406206 IP ip-192-168-1-10.us-west-2.compute.internal.51607 > ussea4-vip-bx-001.aaplimg.com.https: Flags [SEW], seq 3682767340, win 65535, options [mss 1460,nop,wscale 6,nop,nop,TS val 253585008 ecr 0,sackOK,eol], length 0
18:32:36.407315 IP api-den.smoot.apple.com.https > ip-192-168-1-10.us-west-2.compute.internal.51605: Flags [S.E], seq 1292515289, ack 12110197, win 28960, options [mss 1360,nop,nop,TS val 943606162 ecr 253584972,nop,wscale 9], length 0
18:32:36.408967 IP api-den.smoot.apple.com.https > ip-192-168-1-10.us-west-2.compute.internal.51606: Flags [S.E], seq 4201161723, ack 3607473552, win 28960, options [mss 1360,nop,nop,TS val 2849739415 ecr 253584976,nop,wscale 9], length 0
18:32:36.410528 IP ip-192-168-1-10.us-west-2.compute.internal.51605 > api-den.smoot.apple.com.https: Flags [.], ack 1, win 2064, options [nop,nop,TS val 253585015 ecr 943606162], length 0
18:32:36.410544 IP ip-192-168-1-10.us-west-2.compute.internal.51605 > api-den.smoot.apple.com.https: Flags [P.], seq 1:518, ack 1, win 2064, options [nop,nop,TS val 253585016 ecr 943606162], length 517
18:32:36.414889 IP ip-192-168-1-10.us-west-2.compute.internal.51606 > api-den.smoot.apple.com.https: Flags [.], ack 1, win 2064, options [nop,nop,TS val 253585016 ecr 2849739415], length 0
18:32:36.414902 IP ip-192-168-1-10.us-west-2.compute.internal.51606 > api-den.smoot.apple.com.https: Flags [P.], seq 1:518, ack 1, win 2064, options [nop,nop,TS val 253585018 ecr 2849739415], length 517
18:32:36.419316 IP ussea4-vip-bx-001.aaplimg.com.https > ip-192-168-1-10.us-west-2.compute.internal.51607: Flags [S.E], seq 853498320, ack 3682767341, win 28960, options [mss 1360,sackOK,TS val 1616978536 ecr 253585008,nop,wscale 8], length 0
18:32:36.425227 IP ip-192-168-1-10.us-west-2.compute.internal.51607 > ussea4-vip-bx-001.aaplimg.com.https: Flags [.], ack 1, win 2064, options [nop,nop,TS val 253585026 ecr 1616978536], length 0
18:32:36.425245 IP ip-192-168-1-10.us-west-2.compute.internal.51607 > ussea4-vip-bx-001.aaplimg.com.https: Flags [P.], seq 1:239, ack 1, win 2064, options [nop,nop,TS val 253585027 ecr 1616978536], length 238
18:32:36.438943 IP ussea4-vip-bx-001.aaplimg.com.https > ip-192-168-1-10.us-west-2.compute.internal.51607: Flags [.], ack 239, win 118, options [nop,nop,TS val 1616978555 ecr 253585027], length 0
18:32:36.439381 IP ussea4-vip-bx-001.aaplimg.com.https > ip-192-168-1-10.us-west-2.compute.internal.51607: Flags [.], seq 1:1349, ack 239, win 118, options [nop,nop,TS val 1616978555 ecr 253585027], length 1348
18:32:36.439440 IP ussea4-vip-bx-001.aaplimg.com.https > ip-192-168-1-10.us-west-2.compute.internal.51607: Flags [.], seq 1349:2697, ack 239, win 118, options [nop,nop,TS val 1616978555 ecr 253585027], length 1348
18:32:36.439472 IP ussea4-vip-bx-001.aaplimg.com.https > ip-192-168-1-10.us-west-2.compute.internal.51607: Flags [.], seq 2697:4045, ack 239, win 118, options [nop,nop,TS val 1616978555 ecr 253585027], length 1348
18:32:36.439502 IP ussea4-vip-bx-001.aaplimg.com.https > ip-192-168-1-10.us-west-2.compute.internal.51607: Flags [P.], seq 4045:4097, ack 239, win 118, options [nop,nop,TS val 1616978555 ecr 253585027], length 52
18:32:36.441034 IP ussea4-vip-bx-001.aaplimg.com.https > ip-192-168-1-10.us-west-2.compute.internal.51607: Flags [P.], seq 4097:5261, ack 239, win 118, options [nop,nop,TS val 1616978556 ecr 253585027], length 1164
18:32:36.445668 IP ip-192-168-1-10.us-west-2.compute.internal.51607 > ussea4-vip-bx-001.aaplimg.com.https: Flags [.], ack 2697, win 2022, options [nop,nop,TS val 253585045 ecr 1616978555], length 0
18:32:36.445683 IP ip-192-168-1-10.us-west-2.compute.internal.51607 > ussea4-vip-bx-001.aaplimg.com.https: Flags [.], ack 4097, win 2026, options [nop,nop,TS val 253585045 ecr 1616978555], length 0
18:32:36.445693 IP ip-192-168-1-10.us-west-2.compute.internal.51607 > ussea4-vip-bx-001.aaplimg.com.https: Flags [.], ack 5261, win 2029, options [nop,nop,TS val 253585046 ecr 1616978556], length 0
18:32:36.453011 IP api-den.smoot.apple.com.https > ip-192-168-1-10.us-west-2.compute.internal.51605: Flags [.], seq 1:1349, ack 518, win 59, options [nop,nop,TS val 943606208 ecr 253585016], length 1348
18:32:36.453128 IP api-den.smoot.apple.com.https > ip-192-168-1-10.us-west-2.compute.internal.51605: Flags [.], seq 1349:2697, ack 518, win 59, options [nop,nop,TS val 943606208 ecr 253585016], length 1348
18:32:36.453161 IP api-den.smoot.apple.com.https > ip-192-168-1-10.us-west-2.compute.internal.51605: Flags [P.], seq 2697:3632, ack 518, win 59, options [nop,nop,TS val 943606208 ecr 253585016], length 935
18:32:36.455044 IP api-den.smoot.apple.com.https > ip-192-168-1-10.us-west-2.compute.internal.51606: Flags [.], seq 1:1349, ack 518, win 59, options [nop,nop,TS val 2849739461 ecr 253585018], length 1348
18:32:36.455146 IP api-den.smoot.apple.com.https > ip-192-168-1-10.us-west-2.compute.internal.51606: Flags [.], seq 1349:2697, ack 518, win 59, options [nop,nop,TS val 2849739461 ecr 253585018], length 1348
18:32:36.455217 IP api-den.smoot.apple.com.https > ip-192-168-1-10.us-west-2.compute.internal.51606: Flags [P.], seq 2697:3632, ack 518, win 59, options [nop,nop,TS val 2849739461 ecr 253585018], length 935
18:32:36.459459 IP ip-192-168-1-10.us-west-2.compute.internal.51605 > api-den.smoot.apple.com.https: Flags [.], ack 2697, win 2022, options [nop,nop,TS val 253585056 ecr 943606208], length 0
18:32:36.459474 IP ip-192-168-1-10.us-west-2.compute.internal.51605 > api-den.smoot.apple.com.https: Flags [.], ack 3632, win 2007, options [nop,nop,TS val 253585056 ecr 943606208], length 0
18:32:36.459485 IP ip-192-168-1-10.us-west-2.compute.internal.51606 > api-den.smoot.apple.com.https: Flags [.], ack 2697, win 2022, options [nop,nop,TS val 253585057 ecr 2849739461], length 0
18:32:36.459494 IP ip-192-168-1-10.us-west-2.compute.internal.51606 > api-den.smoot.apple.com.https: Flags [.], ack 3632, win 2007, options [nop,nop,TS val 253585057 ecr 2849739461], length 0
18:32:36.528448 IP ip-192-168-1-10.us-west-2.compute.internal.51607 > ussea4-vip-bx-001.aaplimg.com.https: Flags [P.], seq 239:332, ack 5261, win 2048, options [nop,nop,TS val 253585121 ecr 1616978556], length 93
18:32:36.541394 IP ussea4-vip-bx-001.aaplimg.com.https > ip-192-168-1-10.us-west-2.compute.internal.51607: Flags [P.], seq 5261:5312, ack 332, win 118, options [nop,nop,TS val 1616978658 ecr 253585121], length 51
18:32:36.547352 IP ip-192-168-1-10.us-west-2.compute.internal.51607 > ussea4-vip-bx-001.aaplimg.com.https: Flags [.], ack 5312, win 2047, options [nop,nop,TS val 253585138 ecr 1616978658], length 0
18:32:36.584051 IP ip-192-168-1-10.us-west-2.compute.internal.51605 > api-den.smoot.apple.com.https: Flags [P.], seq 518:611, ack 3632, win 2048, options [nop,nop,TS val 253585172 ecr 943606208], length 93
18:32:36.584067 IP ip-192-168-1-10.us-west-2.compute.internal.51606 > api-den.smoot.apple.com.https: Flags [P.], seq 518:611, ack 3632, win 2048, options [nop,nop,TS val 253585174 ecr 2849739461], length 93
18:32:36.588440 IP ip-192-168-1-10.us-west-2.compute.internal.51607 > ussea4-vip-bx-001.aaplimg.com.https: Flags [P.], seq 332:742, ack 5312, win 2048, options [nop,nop,TS val 253585177 ecr 1616978658], length 410
18:32:36.601625 IP ussea4-vip-bx-001.aaplimg.com.https > ip-192-168-1-10.us-west-2.compute.internal.51607: Flags [P.], seq 5312:5892, ack 742, win 122, options [nop,nop,TS val 1616978718 ecr 253585177], length 580
18:32:36.602426 IP ussea4-vip-bx-001.aaplimg.com.https > ip-192-168-1-10.us-west-2.compute.internal.51607: Flags [P.], seq 5892:6080, ack 742, win 122, options [nop,nop,TS val 1616978719 ecr 253585177], length 188
18:32:36.607722 IP ip-192-168-1-10.us-west-2.compute.internal.51607 > ussea4-vip-bx-001.aaplimg.com.https: Flags [.], ack 5892, win 2038, options [nop,nop,TS val 253585193 ecr 1616978718], length 0
18:32:36.607738 IP ip-192-168-1-10.us-west-2.compute.internal.51607 > ussea4-vip-bx-001.aaplimg.com.https: Flags [.], ack 6080, win 2045, options [nop,nop,TS val 253585193 ecr 1616978719], length 0
18:32:36.623175 IP api-den.smoot.apple.com.https > ip-192-168-1-10.us-west-2.compute.internal.51606: Flags [P.], seq 3632:3683, ack 611, win 59, options [nop,nop,TS val 2849739629 ecr 253585174], length 51
18:32:36.625503 IP api-den.smoot.apple.com.https > ip-192-168-1-10.us-west-2.compute.internal.51605: Flags [P.], seq 3632:3683, ack 611, win 59, options [nop,nop,TS val 943606380 ecr 253585172], length 51
18:32:36.629040 IP ip-192-168-1-10.us-west-2.compute.internal.51606 > api-den.smoot.apple.com.https: Flags [.], ack 3683, win 2047, options [nop,nop,TS val 253585212 ecr 2849739629], length 0
18:32:36.629068 IP ip-192-168-1-10.us-west-2.compute.internal.51605 > api-den.smoot.apple.com.https: Flags [.], ack 3683, win 2047, options [nop,nop,TS val 253585214 ecr 943606380], length 0
18:32:36.659327 IP ip-192-168-1-10.us-west-2.compute.internal.51606 > api-den.smoot.apple.com.https: Flags [P.], seq 611:1051, ack 3683, win 2048, options [nop,nop,TS val 253585237 ecr 2849739629], length 440
18:32:36.659343 IP ip-192-168-1-10.us-west-2.compute.internal.51605 > api-den.smoot.apple.com.https: Flags [P.], seq 611:1053, ack 3683, win 2048, options [nop,nop,TS val 253585238 ecr 943606380], length 442
18:32:36.700086 IP api-den.smoot.apple.com.https > ip-192-168-1-10.us-west-2.compute.internal.51606: Flags [P.], seq 3683:4025, ack 1051, win 61, options [nop,nop,TS val 2849739706 ecr 253585237], length 342
18:32:36.703397 IP api-den.smoot.apple.com.https > ip-192-168-1-10.us-west-2.compute.internal.51605: Flags [P.], seq 3683:4027, ack 1053, win 61, options [nop,nop,TS val 943606458 ecr 253585238], length 344
18:32:36.706046 IP ip-192-168-1-10.us-west-2.compute.internal.51606 > api-den.smoot.apple.com.https: Flags [.], ack 4025, win 2042, options [nop,nop,TS val 253585283 ecr 2849739706], length 0
18:32:36.706060 IP ip-192-168-1-10.us-west-2.compute.internal.51605 > api-den.smoot.apple.com.https: Flags [.], ack 4027, win 2042, options [nop,nop,TS val 253585285 ecr 943606458], length 0
18:32:37.689397 IP ip-192-168-1-10.us-west-2.compute.internal.51607 > ussea4-vip-bx-001.aaplimg.com.https: Flags [P.], seq 742:773, ack 6080, win 2048, options [nop,nop,TS val 253586214 ecr 1616978719], length 31
18:32:37.689414 IP ip-192-168-1-10.us-west-2.compute.internal.51607 > ussea4-vip-bx-001.aaplimg.com.https: Flags [F.], seq 773, ack 6080, win 2048, options [nop,nop,TS val 253586223 ecr 1616978719], length 0
18:32:37.702753 IP ussea4-vip-bx-001.aaplimg.com.https > ip-192-168-1-10.us-west-2.compute.internal.51607: Flags [F.], seq 6080, ack 774, win 122, options [nop,nop,TS val 1616979819 ecr 253586214], length 0
18:32:37.711947 IP ip-192-168-1-10.us-west-2.compute.internal.51607 > ussea4-vip-bx-001.aaplimg.com.https: Flags [.], ack 6081, win 2048, options [nop,nop,TS val 253586254 ecr 1616979819], length 0
18:32:37.711963 IP ip-192-168-1-10.us-west-2.compute.internal.51610 > ussea4-vip-bx-003.aaplimg.com.https: Flags [SEW], seq 1383235693, win 65535, options [mss 1460,nop,wscale 6,nop,nop,TS val 253586256 ecr 0,sackOK,eol], length 0
18:32:37.727591 IP ussea4-vip-bx-003.aaplimg.com.https > ip-192-168-1-10.us-west-2.compute.internal.51610: Flags [S.E], seq 1436169992, ack 1383235694, win 28960, options [mss 1360,sackOK,TS val 3959226037 ecr 253586256,nop,wscale 8], length 0
18:32:37.733667 IP ip-192-168-1-10.us-west-2.compute.internal.51610 > ussea4-vip-bx-003.aaplimg.com.https: Flags [.], ack 1, win 2064, options [nop,nop,TS val 253586274 ecr 3959226037], length 0
18:32:37.733683 IP ip-192-168-1-10.us-west-2.compute.internal.51610 > ussea4-vip-bx-003.aaplimg.com.https: Flags [P.], seq 1:518, ack 1, win 2064, options [nop,nop,TS val 253586277 ecr 3959226037], length 517
18:32:37.748741 IP ussea4-vip-bx-003.aaplimg.com.https > ip-192-168-1-10.us-west-2.compute.internal.51610: Flags [.], ack 518, win 118, options [nop,nop,TS val 3959226059 ecr 253586277], length 0
18:32:37.749110 IP ussea4-vip-bx-003.aaplimg.com.https > ip-192-168-1-10.us-west-2.compute.internal.51610: Flags [.], seq 1:1349, ack 518, win 118, options [nop,nop,TS val 3959226059 ecr 253586277], length 1348
18:32:37.749168 IP ussea4-vip-bx-003.aaplimg.com.https > ip-192-168-1-10.us-west-2.compute.internal.51610: Flags [.], seq 1349:2697, ack 518, win 118, options [nop,nop,TS val 3959226059 ecr 253586277], length 1348
18:32:37.749201 IP ussea4-vip-bx-003.aaplimg.com.https > ip-192-168-1-10.us-west-2.compute.internal.51610: Flags [.], seq 2697:4045, ack 518, win 118, options [nop,nop,TS val 3959226059 ecr 253586277], length 1348
18:32:37.749230 IP ussea4-vip-bx-003.aaplimg.com.https > ip-192-168-1-10.us-west-2.compute.internal.51610: Flags [P.], seq 4045:4097, ack 518, win 118, options [nop,nop,TS val 3959226059 ecr 253586277], length 52
18:32:37.750769 IP ussea4-vip-bx-003.aaplimg.com.https > ip-192-168-1-10.us-west-2.compute.internal.51610: Flags [P.], seq 4097:5261, ack 518, win 118, options [nop,nop,TS val 3959226060 ecr 253586277], length 1164
18:32:37.756452 IP ip-192-168-1-10.us-west-2.compute.internal.51610 > ussea4-vip-bx-003.aaplimg.com.https: Flags [.], ack 2697, win 2022, options [nop,nop,TS val 253586295 ecr 3959226059], length 0
18:32:37.756468 IP ip-192-168-1-10.us-west-2.compute.internal.51610 > ussea4-vip-bx-003.aaplimg.com.https: Flags [.], ack 4097, win 2000, options [nop,nop,TS val 253586295 ecr 3959226059], length 0
18:32:37.756478 IP ip-192-168-1-10.us-west-2.compute.internal.51610 > ussea4-vip-bx-003.aaplimg.com.https: Flags [.], ack 4097, win 2048, options [nop,nop,TS val 253586295 ecr 3959226059], length 0
18:32:37.756488 IP ip-192-168-1-10.us-west-2.compute.internal.51610 > ussea4-vip-bx-003.aaplimg.com.https: Flags [.], ack 5261, win 2029, options [nop,nop,TS val 253586295 ecr 3959226060], length 0
18:32:37.857713 IP ip-192-168-1-10.us-west-2.compute.internal.51610 > ussea4-vip-bx-003.aaplimg.com.https: Flags [P.], seq 518:611, ack 5261, win 2048, options [nop,nop,TS val 253586389 ecr 3959226060], length 93
18:32:37.872701 IP ussea4-vip-bx-003.aaplimg.com.https > ip-192-168-1-10.us-west-2.compute.internal.51610: Flags [P.], seq 5261:5312, ack 611, win 118, options [nop,nop,TS val 3959226183 ecr 253586389], length 51
18:32:37.878449 IP ip-192-168-1-10.us-west-2.compute.internal.51610 > ussea4-vip-bx-003.aaplimg.com.https: Flags [.], ack 5312, win 2047, options [nop,nop,TS val 253586410 ecr 3959226183], length 0
18:32:37.882816 IP ip-192-168-1-10.us-west-2.compute.internal.51610 > ussea4-vip-bx-003.aaplimg.com.https: Flags [P.], seq 611:1019, ack 5312, win 2048, options [nop,nop,TS val 253586414 ecr 3959226183], length 408
18:32:37.898495 IP ussea4-vip-bx-003.aaplimg.com.https > ip-192-168-1-10.us-west-2.compute.internal.51610: Flags [P.], seq 5312:5896, ack 1019, win 122, options [nop,nop,TS val 3959226208 ecr 253586414], length 584
18:32:37.898812 IP ussea4-vip-bx-003.aaplimg.com.https > ip-192-168-1-10.us-west-2.compute.internal.51610: Flags [.], seq 5896:7244, ack 1019, win 122, options [nop,nop,TS val 3959226208 ecr 253586414], length 1348
18:32:37.898872 IP ussea4-vip-bx-003.aaplimg.com.https > ip-192-168-1-10.us-west-2.compute.internal.51610: Flags [.], seq 7244:8592, ack 1019, win 122, options [nop,nop,TS val 3959226208 ecr 253586414], length 1348
18:32:37.898905 IP ussea4-vip-bx-003.aaplimg.com.https > ip-192-168-1-10.us-west-2.compute.internal.51610: Flags [.], seq 8592:9940, ack 1019, win 122, options [nop,nop,TS val 3959226208 ecr 253586414], length 1348
18:32:37.898935 IP ussea4-vip-bx-003.aaplimg.com.https > ip-192-168-1-10.us-west-2.compute.internal.51610: Flags [.], seq 9940:11288, ack 1019, win 122, options [nop,nop,TS val 3959226208 ecr 253586414], length 1348
18:32:37.901410 IP ussea4-vip-bx-003.aaplimg.com.https > ip-192-168-1-10.us-west-2.compute.internal.51610: Flags [.], seq 11288:12636, ack 1019, win 122, options [nop,nop,TS val 3959226209 ecr 253586414], length 1348
18:32:37.901465 IP ussea4-vip-bx-003.aaplimg.com.https > ip-192-168-1-10.us-west-2.compute.internal.51610: Flags [.], seq 12636:13984, ack 1019, win 122, options [nop,nop,TS val 3959226209 ecr 253586414], length 1348
18:32:37.901496 IP ussea4-vip-bx-003.aaplimg.com.https > ip-192-168-1-10.us-west-2.compute.internal.51610: Flags [.], seq 13984:15332, ack 1019, win 122, options [nop,nop,TS val 3959226209 ecr 253586414], length 1348
18:32:37.901522 IP ussea4-vip-bx-003.aaplimg.com.https > ip-192-168-1-10.us-west-2.compute.internal.51610: Flags [.], seq 15332:16680, ack 1019, win 122, options [nop,nop,TS val 3959226209 ecr 253586414], length 1348
18:32:37.904706 IP ip-192-168-1-10.us-west-2.compute.internal.51610 > ussea4-vip-bx-003.aaplimg.com.https: Flags [.], ack 5896, win 2038, options [nop,nop,TS val 253586435 ecr 3959226208], length 0
18:32:37.904724 IP ip-192-168-1-10.us-west-2.compute.internal.51610 > ussea4-vip-bx-003.aaplimg.com.https: Flags [.], ack 8592, win 2005, options [nop,nop,TS val 253586435 ecr 3959226208], length 0
18:32:37.904734 IP ip-192-168-1-10.us-west-2.compute.internal.51610 > ussea4-vip-bx-003.aaplimg.com.https: Flags [.], ack 8592, win 2048, options [nop,nop,TS val 253586435 ecr 3959226208], length 0
18:32:37.904743 IP ip-192-168-1-10.us-west-2.compute.internal.51610 > ussea4-vip-bx-003.aaplimg.com.https: Flags [.], ack 11288, win 2005, options [nop,nop,TS val 253586435 ecr 3959226208], length 0
18:32:37.904761 IP ip-192-168-1-10.us-west-2.compute.internal.51610 > ussea4-vip-bx-003.aaplimg.com.https: Flags [.], ack 11288, win 2048, options [nop,nop,TS val 253586436 ecr 3959226208], length 0
18:32:37.905003 IP ussea4-vip-bx-003.aaplimg.com.https > ip-192-168-1-10.us-west-2.compute.internal.51610: Flags [.], seq 16680:18028, ack 1019, win 122, options [nop,nop,TS val 3959226209 ecr 253586414], length 1348
18:32:37.916802 IP ip-192-168-1-10.us-west-2.compute.internal.51610 > ussea4-vip-bx-003.aaplimg.com.https: Flags [.], ack 13984, win 2005, options [nop,nop,TS val 253586446 ecr 3959226209], length 0
18:32:37.916816 IP ip-192-168-1-10.us-west-2.compute.internal.51610 > ussea4-vip-bx-003.aaplimg.com.https: Flags [.], ack 13984, win 2048, options [nop,nop,TS val 253586446 ecr 3959226209], length 0
18:32:37.916825 IP ip-192-168-1-10.us-west-2.compute.internal.51610 > ussea4-vip-bx-003.aaplimg.com.https: Flags [.], ack 16680, win 2026, options [nop,nop,TS val 253586446 ecr 3959226209], length 0
18:32:37.916835 IP ip-192-168-1-10.us-west-2.compute.internal.51610 > ussea4-vip-bx-003.aaplimg.com.https: Flags [.], ack 18028, win 2048, options [nop,nop,TS val 253586446 ecr 3959226209], length 0
18:32:37.920981 IP ussea4-vip-bx-003.aaplimg.com.https > ip-192-168-1-10.us-west-2.compute.internal.51610: Flags [.], seq 18028:19376, ack 1019, win 122, options [nop,nop,TS val 3959226231 ecr 253586435], length 1348
18:32:37.921061 IP ussea4-vip-bx-003.aaplimg.com.https > ip-192-168-1-10.us-west-2.compute.internal.51610: Flags [.], seq 19376:20724, ack 1019, win 122, options [nop,nop,TS val 3959226231 ecr 253586435], length 1348
18:32:37.921094 IP ussea4-vip-bx-003.aaplimg.com.https > ip-192-168-1-10.us-west-2.compute.internal.51610: Flags [.], seq 20724:22072, ack 1019, win 122, options [nop,nop,TS val 3959226231 ecr 253586435], length 1348
18:32:37.921122 IP ussea4-vip-bx-003.aaplimg.com.https > ip-192-168-1-10.us-west-2.compute.internal.51610: Flags [.], seq 22072:23420, ack 1019, win 122, options [nop,nop,TS val 3959226231 ecr 253586435], length 1348
18:32:37.923445 IP ussea4-vip-bx-003.aaplimg.com.https > ip-192-168-1-10.us-west-2.compute.internal.51610: Flags [.], seq 23420:24768, ack 1019, win 122, options [nop,nop,TS val 3959226231 ecr 253586435], length 1348
18:32:37.923505 IP ussea4-vip-bx-003.aaplimg.com.https > ip-192-168-1-10.us-west-2.compute.internal.51610: Flags [.], seq 24768:26116, ack 1019, win 122, options [nop,nop,TS val 3959226231 ecr 253586435], length 1348
18:32:37.925171 IP ussea4-vip-bx-003.aaplimg.com.https > ip-192-168-1-10.us-west-2.compute.internal.51610: Flags [.], seq 26116:27464, ack 1019, win 122, options [nop,nop,TS val 3959226232 ecr 253586436], length 1348
18:32:37.925213 IP ussea4-vip-bx-003.aaplimg.com.https > ip-192-168-1-10.us-west-2.compute.internal.51610: Flags [.], seq 27464:28812, ack 1019, win 122, options [nop,nop,TS val 3959226232 ecr 253586436], length 1348
18:32:37.925240 IP ussea4-vip-bx-003.aaplimg.com.https > ip-192-168-1-10.us-west-2.compute.internal.51610: Flags [.], seq 28812:30160, ack 1019, win 122, options [nop,nop,TS val 3959226232 ecr 253586436], length 1348
18:32:37.927450 IP ip-192-168-1-10.us-west-2.compute.internal.51610 > ussea4-vip-bx-003.aaplimg.com.https: Flags [.], ack 20724, win 2005, options [nop,nop,TS val 253586456 ecr 3959226231], length 0
18:32:37.927465 IP ip-192-168-1-10.us-west-2.compute.internal.51610 > ussea4-vip-bx-003.aaplimg.com.https: Flags [.], ack 20724, win 2048, options [nop,nop,TS val 253586456 ecr 3959226231], length 0
18:32:37.927475 IP ip-192-168-1-10.us-west-2.compute.internal.51610 > ussea4-vip-bx-003.aaplimg.com.https: Flags [.], ack 23420, win 2026, options [nop,nop,TS val 253586456 ecr 3959226231], length 0
18:32:37.927485 IP ip-192-168-1-10.us-west-2.compute.internal.51610 > ussea4-vip-bx-003.aaplimg.com.https: Flags [.], ack 24768, win 2048, options [nop,nop,TS val 253586458 ecr 3959226231], length 0
18:32:37.927498 IP ip-192-168-1-10.us-west-2.compute.internal.51610 > ussea4-vip-bx-003.aaplimg.com.https: Flags [.], ack 27464, win 2026, options [nop,nop,TS val 253586459 ecr 3959226231], length 0
18:32:37.927507 IP ip-192-168-1-10.us-west-2.compute.internal.51610 > ussea4-vip-bx-003.aaplimg.com.https: Flags [.], ack 30160, win 1984, options [nop,nop,TS val 253586459 ecr 3959226232], length 0
18:32:37.927904 IP ussea4-vip-bx-003.aaplimg.com.https > ip-192-168-1-10.us-west-2.compute.internal.51610: Flags [.], seq 30160:31508, ack 1019, win 122, options [nop,nop,TS val 3959226232 ecr 253586436], length 1348
18:32:37.931783 IP ip-192-168-1-10.us-west-2.compute.internal.51610 > ussea4-vip-bx-003.aaplimg.com.https: Flags [.], ack 30160, win 2048, options [nop,nop,TS val 253586459 ecr 3959226232], length 0
18:32:37.932284 IP ussea4-vip-bx-003.aaplimg.com.https > ip-192-168-1-10.us-west-2.compute.internal.51610: Flags [.], seq 31508:32856, ack 1019, win 122, options [nop,nop,TS val 3959226242 ecr 253586446], length 1348
18:32:37.932363 IP ussea4-vip-bx-003.aaplimg.com.https > ip-192-168-1-10.us-west-2.compute.internal.51610: Flags [.], seq 32856:34204, ack 1019, win 122, options [nop,nop,TS val 3959226242 ecr 253586446], length 1348
18:32:37.932398 IP ussea4-vip-bx-003.aaplimg.com.https > ip-192-168-1-10.us-west-2.compute.internal.51610: Flags [.], seq 34204:35552, ack 1019, win 122, options [nop,nop,TS val 3959226242 ecr 253586446], length 1348
18:32:37.932429 IP ussea4-vip-bx-003.aaplimg.com.https > ip-192-168-1-10.us-west-2.compute.internal.51610: Flags [.], seq 35552:36900, ack 1019, win 122, options [nop,nop,TS val 3959226242 ecr 253586446], length 1348
18:32:37.932457 IP ussea4-vip-bx-003.aaplimg.com.https > ip-192-168-1-10.us-west-2.compute.internal.51610: Flags [.], seq 36900:38248, ack 1019, win 122, options [nop,nop,TS val 3959226242 ecr 253586446], length 1348
18:32:37.932494 IP ussea4-vip-bx-003.aaplimg.com.https > ip-192-168-1-10.us-west-2.compute.internal.51610: Flags [.], seq 38248:39596, ack 1019, win 122, options [nop,nop,TS val 3959226242 ecr 253586446], length 1348
18:32:37.932507 IP ussea4-vip-bx-003.aaplimg.com.https > ip-192-168-1-10.us-west-2.compute.internal.51610: Flags [.], seq 39596:40944, ack 1019, win 122, options [nop,nop,TS val 3959226242 ecr 253586446], length 1348
18:32:37.932520 IP ussea4-vip-bx-003.aaplimg.com.https > ip-192-168-1-10.us-west-2.compute.internal.51610: Flags [.], seq 40944:42292, ack 1019, win 122, options [nop,nop,TS val 3959226242 ecr 253586446], length 1348
18:32:37.936303 IP ip-192-168-1-10.us-west-2.compute.internal.51610 > ussea4-vip-bx-003.aaplimg.com.https: Flags [.], ack 32856, win 2026, options [nop,nop,TS val 253586465 ecr 3959226232], length 0
18:32:37.936317 IP ip-192-168-1-10.us-west-2.compute.internal.51610 > ussea4-vip-bx-003.aaplimg.com.https: Flags [.], ack 35552, win 1984, options [nop,nop,TS val 253586465 ecr 3959226242], length 0
18:32:37.936327 IP ip-192-168-1-10.us-west-2.compute.internal.51610 > ussea4-vip-bx-003.aaplimg.com.https: Flags [.], ack 35552, win 2048, options [nop,nop,TS val 253586465 ecr 3959226242], length 0
18:32:37.936337 IP ip-192-168-1-10.us-west-2.compute.internal.51610 > ussea4-vip-bx-003.aaplimg.com.https: Flags [.], ack 38248, win 2005, options [nop,nop,TS val 253586465 ecr 3959226242], length 0
18:32:37.936346 IP ip-192-168-1-10.us-west-2.compute.internal.51610 > ussea4-vip-bx-003.aaplimg.com.https: Flags [.], ack 38248, win 2048, options [nop,nop,TS val 253586465 ecr 3959226242], length 0
18:32:37.936355 IP ip-192-168-1-10.us-west-2.compute.internal.51610 > ussea4-vip-bx-003.aaplimg.com.https: Flags [.], ack 40944, win 2026, options [nop,nop,TS val 253586465 ecr 3959226242], length 0
18:32:37.938189 IP ussea4-vip-bx-003.aaplimg.com.https > ip-192-168-1-10.us-west-2.compute.internal.51610: Flags [.], seq 42292:43640, ack 1019, win 122, options [nop,nop,TS val 3959226242 ecr 253586446], length 1348
18:32:37.938262 IP ussea4-vip-bx-003.aaplimg.com.https > ip-192-168-1-10.us-west-2.compute.internal.51610: Flags [.], seq 43640:44988, ack 1019, win 122, options [nop,nop,TS val 3959226242 ecr 253586446], length 1348
18:32:37.940651 IP ip-192-168-1-10.us-west-2.compute.internal.51610 > ussea4-vip-bx-003.aaplimg.com.https: Flags [.], ack 42292, win 2048, options [nop,nop,TS val 253586466 ecr 3959226242], length 0
18:32:37.940664 IP ip-192-168-1-10.us-west-2.compute.internal.51610 > ussea4-vip-bx-003.aaplimg.com.https: Flags [.], ack 44988, win 2026, options [nop,nop,TS val 253586470 ecr 3959226242], length 0
18:32:37.943460 IP ussea4-vip-bx-003.aaplimg.com.https > ip-192-168-1-10.us-west-2.compute.internal.51610: Flags [.], seq 44988:46336, ack 1019, win 122, options [nop,nop,TS val 3959226253 ecr 253586456], length 1348
18:32:37.943519 IP ussea4-vip-bx-003.aaplimg.com.https > ip-192-168-1-10.us-west-2.compute.internal.51610: Flags [.], seq 46336:47684, ack 1019, win 122, options [nop,nop,TS val 3959226253 ecr 253586456], length 1348
18:32:37.943549 IP ussea4-vip-bx-003.aaplimg.com.https > ip-192-168-1-10.us-west-2.compute.internal.51610: Flags [.], seq 47684:49032, ack 1019, win 122, options [nop,nop,TS val 3959226253 ecr 253586456], length 1348
18:32:37.943576 IP ussea4-vip-bx-003.aaplimg.com.https > ip-192-168-1-10.us-west-2.compute.internal.51610: Flags [.], seq 49032:50380, ack 1019, win 122, options [nop,nop,TS val 3959226253 ecr 253586456], length 1348
18:32:37.945913 IP ussea4-vip-bx-003.aaplimg.com.https > ip-192-168-1-10.us-west-2.compute.internal.51610: Flags [.], seq 50380:51728, ack 1019, win 122, options [nop,nop,TS val 3959226254 ecr 253586459], length 1348
18:32:37.946813 IP ussea4-vip-bx-003.aaplimg.com.https > ip-192-168-1-10.us-west-2.compute.internal.51610: Flags [.], seq 51728:53076, ack 1019, win 122, options [nop,nop,TS val 3959226254 ecr 253586459], length 1348
18:32:37.946862 IP ussea4-vip-bx-003.aaplimg.com.https > ip-192-168-1-10.us-west-2.compute.internal.51610: Flags [.], seq 53076:54424, ack 1019, win 122, options [nop,nop,TS val 3959226254 ecr 253586459], length 1348
18:32:37.946893 IP ussea4-vip-bx-003.aaplimg.com.https > ip-192-168-1-10.us-west-2.compute.internal.51610: Flags [.], seq 54424:55772, ack 1019, win 122, options [nop,nop,TS val 3959226254 ecr 253586459], length 1348
18:32:37.946919 IP ussea4-vip-bx-003.aaplimg.com.https > ip-192-168-1-10.us-west-2.compute.internal.51610: Flags [.], seq 55772:57120, ack 1019, win 122, options [nop,nop,TS val 3959226254 ecr 253586459], length 1348
18:32:37.946947 IP ussea4-vip-bx-003.aaplimg.com.https > ip-192-168-1-10.us-west-2.compute.internal.51610: Flags [.], seq 57120:58468, ack 1019, win 122, options [nop,nop,TS val 3959226254 ecr 253586459], length 1348
18:32:37.949906 IP ip-192-168-1-10.us-west-2.compute.internal.51610 > ussea4-vip-bx-003.aaplimg.com.https: Flags [.], ack 46336, win 2048, options [nop,nop,TS val 253586475 ecr 3959226253], length 0
18:32:37.949919 IP ip-192-168-1-10.us-west-2.compute.internal.51610 > ussea4-vip-bx-003.aaplimg.com.https: Flags [.], ack 49032, win 2026, options [nop,nop,TS val 253586475 ecr 3959226253], length 0
18:32:37.949929 IP ip-192-168-1-10.us-west-2.compute.internal.51610 > ussea4-vip-bx-003.aaplimg.com.https: Flags [.], ack 50380, win 2048, options [nop,nop,TS val 253586475 ecr 3959226253], length 0
18:32:37.949939 IP ip-192-168-1-10.us-west-2.compute.internal.51610 > ussea4-vip-bx-003.aaplimg.com.https: Flags [.], ack 53076, win 2026, options [nop,nop,TS val 253586478 ecr 3959226254], length 0
18:32:37.949949 IP ip-192-168-1-10.us-west-2.compute.internal.51610 > ussea4-vip-bx-003.aaplimg.com.https: Flags [.], ack 55772, win 2005, options [nop,nop,TS val 253586478 ecr 3959226254], length 0
18:32:37.949958 IP ip-192-168-1-10.us-west-2.compute.internal.51610 > ussea4-vip-bx-003.aaplimg.com.https: Flags [.], ack 57120, win 2026, options [nop,nop,TS val 253586478 ecr 3959226254], length 0
18:32:37.949967 IP ip-192-168-1-10.us-west-2.compute.internal.51610 > ussea4-vip-bx-003.aaplimg.com.https: Flags [.], ack 58468, win 2048, options [nop,nop,TS val 253586478 ecr 3959226254], length 0
18:32:37.951122 IP ussea4-vip-bx-003.aaplimg.com.https > ip-192-168-1-10.us-west-2.compute.internal.51610: Flags [.], seq 58468:59816, ack 1019, win 122, options [nop,nop,TS val 3959226255 ecr 253586459], length 1348
18:32:37.951174 IP ussea4-vip-bx-003.aaplimg.com.https > ip-192-168-1-10.us-west-2.compute.internal.51610: Flags [.], seq 59816:61164, ack 1019, win 122, options [nop,nop,TS val 3959226255 ecr 253586459], length 1348
18:32:37.951205 IP ussea4-vip-bx-003.aaplimg.com.https > ip-192-168-1-10.us-west-2.compute.internal.51610: Flags [.], seq 61164:62512, ack 1019, win 122, options [nop,nop,TS val 3959226255 ecr 253586459], length 1348
18:32:37.951232 IP ussea4-vip-bx-003.aaplimg.com.https > ip-192-168-1-10.us-west-2.compute.internal.51610: Flags [.], seq 62512:63860, ack 1019, win 122, options [nop,nop,TS val 3959226255 ecr 253586459], length 1348
18:32:37.954291 IP ip-192-168-1-10.us-west-2.compute.internal.51610 > ussea4-vip-bx-003.aaplimg.com.https: Flags [.], ack 61164, win 2026, options [nop,nop,TS val 253586482 ecr 3959226255], length 0
18:32:37.954305 IP ip-192-168-1-10.us-west-2.compute.internal.51610 > ussea4-vip-bx-003.aaplimg.com.https: Flags [.], ack 62512, win 2048, options [nop,nop,TS val 253586482 ecr 3959226255], length 0
18:32:37.954564 IP ussea4-vip-bx-003.aaplimg.com.https > ip-192-168-1-10.us-west-2.compute.internal.51610: Flags [.], seq 63860:65208, ack 1019, win 122, options [nop,nop,TS val 3959226255 ecr 253586459], length 1348
18:32:37.954620 IP ussea4-vip-bx-003.aaplimg.com.https > ip-192-168-1-10.us-west-2.compute.internal.51610: Flags [.], seq 65208:66556, ack 1019, win 122, options [nop,nop,TS val 3959226255 ecr 253586459], length 1348
18:32:37.956294 IP ussea4-vip-bx-003.aaplimg.com.https > ip-192-168-1-10.us-west-2.compute.internal.51610: Flags [.], seq 66556:67904, ack 1019, win 122, options [nop,nop,TS val 3959226256 ecr 253586459], length 1348
18:32:37.956343 IP ussea4-vip-bx-003.aaplimg.com.https > ip-192-168-1-10.us-west-2.compute.internal.51610: Flags [.], seq 67904:69252, ack 1019, win 122, options [nop,nop,TS val 3959226256 ecr 253586459], length 1348
18:32:37.958034 IP ussea4-vip-bx-003.aaplimg.com.https > ip-192-168-1-10.us-west-2.compute.internal.51610: Flags [.], seq 69252:70600, ack 1019, win 122, options [nop,nop,TS val 3959226261 ecr 253586465], length 1348
18:32:37.958095 IP ussea4-vip-bx-003.aaplimg.com.https > ip-192-168-1-10.us-west-2.compute.internal.51610: Flags [.], seq 70600:71948, ack 1019, win 122, options [nop,nop,TS val 3959226261 ecr 253586465], length 1348
18:32:37.958126 IP ussea4-vip-bx-003.aaplimg.com.https > ip-192-168-1-10.us-west-2.compute.internal.51610: Flags [.], seq 71948:73296, ack 1019, win 122, options [nop,nop,TS val 3959226261 ecr 253586465], length 1348
18:32:37.958154 IP ussea4-vip-bx-003.aaplimg.com.https > ip-192-168-1-10.us-west-2.compute.internal.51610: Flags [.], seq 73296:74644, ack 1019, win 122, options [nop,nop,TS val 3959226261 ecr 253586465], length 1348
18:32:37.958656 IP ip-192-168-1-10.us-west-2.compute.internal.51610 > ussea4-vip-bx-003.aaplimg.com.https: Flags [.], ack 65208, win 2026, options [nop,nop,TS val 253586485 ecr 3959226255], length 0
18:32:37.958668 IP ip-192-168-1-10.us-west-2.compute.internal.51610 > ussea4-vip-bx-003.aaplimg.com.https: Flags [.], ack 66556, win 2048, options [nop,nop,TS val 253586485 ecr 3959226255], length 0
18:32:37.958678 IP ip-192-168-1-10.us-west-2.compute.internal.51610 > ussea4-vip-bx-003.aaplimg.com.https: Flags [.], ack 69252, win 2005, options [nop,nop,TS val 253586486 ecr 3959226256], length 0
18:32:37.958688 IP ip-192-168-1-10.us-west-2.compute.internal.51610 > ussea4-vip-bx-003.aaplimg.com.https: Flags [.], ack 69252, win 2048, options [nop,nop,TS val 253586486 ecr 3959226256], length 0
18:32:37.961473 IP ussea4-vip-bx-003.aaplimg.com.https > ip-192-168-1-10.us-west-2.compute.internal.51610: Flags [.], seq 74644:75992, ack 1019, win 122, options [nop,nop,TS val 3959226262 ecr 253586465], length 1348
18:32:37.961524 IP ussea4-vip-bx-003.aaplimg.com.https > ip-192-168-1-10.us-west-2.compute.internal.51610: Flags [.], seq 75992:77340, ack 1019, win 122, options [nop,nop,TS val 3959226262 ecr 253586465], length 1348
18:32:37.961552 IP ussea4-vip-bx-003.aaplimg.com.https > ip-192-168-1-10.us-west-2.compute.internal.51610: Flags [.], seq 77340:78688, ack 1019, win 122, options [nop,nop,TS val 3959226262 ecr 253586465], length 1348
18:32:37.961580 IP ussea4-vip-bx-003.aaplimg.com.https > ip-192-168-1-10.us-west-2.compute.internal.51610: Flags [.], seq 78688:80036, ack 1019, win 122, options [nop,nop,TS val 3959226262 ecr 253586465], length 1348
18:32:37.963024 IP ip-192-168-1-10.us-west-2.compute.internal.51610 > ussea4-vip-bx-003.aaplimg.com.https: Flags [.], ack 71948, win 2005, options [nop,nop,TS val 253586487 ecr 3959226261], length 0
18:32:37.963037 IP ip-192-168-1-10.us-west-2.compute.internal.51610 > ussea4-vip-bx-003.aaplimg.com.https: Flags [.], ack 73296, win 2048, options [nop,nop,TS val 253586487 ecr 3959226261], length 0
18:32:37.965017 IP ussea4-vip-bx-003.aaplimg.com.https > ip-192-168-1-10.us-west-2.compute.internal.51610: Flags [.], seq 80036:81384, ack 1019, win 122, options [nop,nop,TS val 3959226262 ecr 253586465], length 1348
18:32:37.965116 IP ussea4-vip-bx-003.aaplimg.com.https > ip-192-168-1-10.us-west-2.compute.internal.51610: Flags [.], seq 81384:82732, ack 1019, win 122, options [nop,nop,TS val 3959226262 ecr 253586465], length 1348
18:32:37.965156 IP ussea4-vip-bx-003.aaplimg.com.https > ip-192-168-1-10.us-west-2.compute.internal.51610: Flags [.], seq 82732:84080, ack 1019, win 122, options [nop,nop,TS val 3959226262 ecr 253586465], length 1348
18:32:37.965187 IP ussea4-vip-bx-003.aaplimg.com.https > ip-192-168-1-10.us-west-2.compute.internal.51610: Flags [.], seq 84080:85428, ack 1019, win 122, options [nop,nop,TS val 3959226262 ecr 253586465], length 1348
18:32:37.965244 IP ussea4-vip-bx-003.aaplimg.com.https > ip-192-168-1-10.us-west-2.compute.internal.51610: Flags [.], seq 85428:86776, ack 1019, win 122, options [nop,nop,TS val 3959226262 ecr 253586465], length 1348
18:32:37.967462 IP ip-192-168-1-10.us-west-2.compute.internal.51610 > ussea4-vip-bx-003.aaplimg.com.https: Flags [.], ack 75992, win 2026, options [nop,nop,TS val 253586490 ecr 3959226261], length 0
18:32:37.967477 IP ip-192-168-1-10.us-west-2.compute.internal.51610 > ussea4-vip-bx-003.aaplimg.com.https: Flags [.], ack 78688, win 1984, options [nop,nop,TS val 253586490 ecr 3959226262], length 0
18:32:37.967488 IP ip-192-168-1-10.us-west-2.compute.internal.51610 > ussea4-vip-bx-003.aaplimg.com.https: Flags [.], ack 80036, win 2048, options [nop,nop,TS val 253586491 ecr 3959226262], length 0
18:32:37.967497 IP ip-192-168-1-10.us-west-2.compute.internal.51610 > ussea4-vip-bx-003.aaplimg.com.https: Flags [.], ack 82732, win 2005, options [nop,nop,TS val 253586493 ecr 3959226262], length 0
18:32:37.969284 IP ussea4-vip-bx-003.aaplimg.com.https > ip-192-168-1-10.us-west-2.compute.internal.51610: Flags [.], seq 86776:88124, ack 1019, win 122, options [nop,nop,TS val 3959226263 ecr 253586465], length 1348
18:32:37.969379 IP ussea4-vip-bx-003.aaplimg.com.https > ip-192-168-1-10.us-west-2.compute.internal.51610: Flags [.], seq 88124:89472, ack 1019, win 122, options [nop,nop,TS val 3959226263 ecr 253586465], length 1348
18:32:37.969411 IP ussea4-vip-bx-003.aaplimg.com.https > ip-192-168-1-10.us-west-2.compute.internal.51610: Flags [.], seq 89472:90820, ack 1019, win 122, options [nop,nop,TS val 3959226263 ecr 253586465], length 1348
18:32:37.971885 IP ussea4-vip-bx-003.aaplimg.com.https > ip-192-168-1-10.us-west-2.compute.internal.51610: Flags [.], seq 90820:92168, ack 1019, win 122, options [nop,nop,TS val 3959226265 ecr 253586466], length 1348
18:32:37.971943 IP ussea4-vip-bx-003.aaplimg.com.https > ip-192-168-1-10.us-west-2.compute.internal.51610: Flags [.], seq 92168:93516, ack 1019, win 122, options [nop,nop,TS val 3959226265 ecr 253586466], length 1348
18:32:37.971810 IP ip-192-168-1-10.us-west-2.compute.internal.51610 > ussea4-vip-bx-003.aaplimg.com.https: Flags [.], ack 84080, win 2048, options [nop,nop,TS val 253586493 ecr 3959226262], length 0
18:32:37.971825 IP ip-192-168-1-10.us-west-2.compute.internal.51610 > ussea4-vip-bx-003.aaplimg.com.https: Flags [.], ack 86776, win 2005, options [nop,nop,TS val 253586493 ecr 3959226262], length 0
18:32:37.971835 IP ip-192-168-1-10.us-west-2.compute.internal.51610 > ussea4-vip-bx-003.aaplimg.com.https: Flags [.], ack 86776, win 2048, options [nop,nop,TS val 253586493 ecr 3959226262], length 0
