tcpdump: verbose output suppressed, use -v or -vv for full protocol decode
listening on wlan0, link-type EN10MB (Ethernet), capture size 262144 bytes
13:01:11.775724 IP ip-192-168-1-10.us-west-2.compute.internal.50618 > a23-35-96-63.deploy.static.akamaitechnologies.com.https: Flags [SEW], seq 915292178, win 65535, options [mss 1460,nop,wscale 6,nop,nop,TS val 145475362 ecr 0,sackOK,eol], length 0
13:01:11.791839 IP a23-35-96-63.deploy.static.akamaitechnologies.com.https > ip-192-168-1-10.us-west-2.compute.internal.50618: Flags [S.], seq 3228225096, ack 915292179, win 28960, options [mss 1360,sackOK,TS val 327931876 ecr 145475362,nop,wscale 7], length 0
13:01:11.793505 IP ip-192-168-1-10.us-west-2.compute.internal.50618 > a23-35-96-63.deploy.static.akamaitechnologies.com.https: Flags [.], ack 1, win 2064, options [nop,nop,TS val 145475379 ecr 327931876], length 0
13:01:11.794873 IP ip-192-168-1-10.us-west-2.compute.internal.50618 > a23-35-96-63.deploy.static.akamaitechnologies.com.https: Flags [P.], seq 1:241, ack 1, win 2064, options [nop,nop,TS val 145475379 ecr 327931876], length 240
13:01:11.810889 IP a23-35-96-63.deploy.static.akamaitechnologies.com.https > ip-192-168-1-10.us-west-2.compute.internal.50618: Flags [.], ack 241, win 235, options [nop,nop,TS val 327931895 ecr 145475379], length 0
13:01:11.811212 IP a23-35-96-63.deploy.static.akamaitechnologies.com.https > ip-192-168-1-10.us-west-2.compute.internal.50618: Flags [.], seq 1:1349, ack 241, win 235, options [nop,nop,TS val 327931895 ecr 145475379], length 1348
13:01:11.811292 IP a23-35-96-63.deploy.static.akamaitechnologies.com.https > ip-192-168-1-10.us-west-2.compute.internal.50618: Flags [.], seq 1349:2697, ack 241, win 235, options [nop,nop,TS val 327931895 ecr 145475379], length 1348
13:01:11.811325 IP a23-35-96-63.deploy.static.akamaitechnologies.com.https > ip-192-168-1-10.us-west-2.compute.internal.50618: Flags [.], seq 2697:4045, ack 241, win 235, options [nop,nop,TS val 327931895 ecr 145475379], length 1348
13:01:11.811354 IP a23-35-96-63.deploy.static.akamaitechnologies.com.https > ip-192-168-1-10.us-west-2.compute.internal.50618: Flags [P.], seq 4045:4097, ack 241, win 235, options [nop,nop,TS val 327931895 ecr 145475379], length 52
13:01:11.813656 IP ip-192-168-1-10.us-west-2.compute.internal.50618 > a23-35-96-63.deploy.static.akamaitechnologies.com.https: Flags [.], ack 2697, win 2022, options [nop,nop,TS val 145475396 ecr 327931895], length 0
13:01:11.813684 IP ip-192-168-1-10.us-west-2.compute.internal.50618 > a23-35-96-63.deploy.static.akamaitechnologies.com.https: Flags [.], ack 4097, win 2026, options [nop,nop,TS val 145475396 ecr 327931895], length 0
13:01:11.829771 IP a23-35-96-63.deploy.static.akamaitechnologies.com.https > ip-192-168-1-10.us-west-2.compute.internal.50618: Flags [.], seq 4097:5445, ack 241, win 235, options [nop,nop,TS val 327931914 ecr 145475396], length 1348
13:01:11.829886 IP a23-35-96-63.deploy.static.akamaitechnologies.com.https > ip-192-168-1-10.us-west-2.compute.internal.50618: Flags [P.], seq 5445:6041, ack 241, win 235, options [nop,nop,TS val 327931914 ecr 145475396], length 596
13:01:11.838515 IP ip-192-168-1-10.us-west-2.compute.internal.50618 > a23-35-96-63.deploy.static.akamaitechnologies.com.https: Flags [.], ack 6041, win 2017, options [nop,nop,TS val 145475419 ecr 327931914], length 0
13:01:11.874374 IP ip-192-168-1-10.us-west-2.compute.internal.50619 > 72.21.91.29.www: Flags [SEW], seq 2371837348, win 65535, options [mss 1460,nop,wscale 6,nop,nop,TS val 145475448 ecr 0,sackOK,eol], length 0
13:01:11.881604 IP 72.21.91.29.www > ip-192-168-1-10.us-west-2.compute.internal.50619: Flags [S.E], seq 21527807, ack 2371837349, win 26960, options [mss 1360,sackOK,TS val 3729072733 ecr 145475448,nop,wscale 7], length 0
13:01:11.883402 IP ip-192-168-1-10.us-west-2.compute.internal.50619 > 72.21.91.29.www: Flags [.], ack 1, win 2064, options [nop,nop,TS val 145475456 ecr 3729072733], length 0
13:01:11.884597 IP ip-192-168-1-10.us-west-2.compute.internal.50619 > 72.21.91.29.www: Flags [P.], seq 1:261, ack 1, win 2064, options [nop,nop,TS val 145475457 ecr 3729072733], length 260: HTTP: GET /MFYwVKADAgEAME0wSzBJMAkGBSsOAwIaBQAEFN%2BqEuMosQlBk%2BKfQoLOR0BClVijBBSxPsNpA%2Fi%2FRwHUmCYaCALvY2QrwwIQDHmpRLCMEZUgkmFf4msdgw%3D%3D HTTP/1.1
13:01:11.891762 IP 72.21.91.29.www > ip-192-168-1-10.us-west-2.compute.internal.50619: Flags [.], ack 261, win 219, options [nop,nop,TS val 3729072743 ecr 145475457], length 0
13:01:11.894865 IP 72.21.91.29.www > ip-192-168-1-10.us-west-2.compute.internal.50619: Flags [P.], seq 1:1032, ack 261, win 219, options [nop,nop,TS val 3729072747 ecr 145475457], length 1031: HTTP: HTTP/1.1 200 OK
13:01:11.895070 IP 72.21.91.29.www > ip-192-168-1-10.us-west-2.compute.internal.50619: Flags [F.], seq 1032, ack 261, win 219, options [nop,nop,TS val 3729072747 ecr 145475457], length 0
13:01:11.898849 IP ip-192-168-1-10.us-west-2.compute.internal.50619 > 72.21.91.29.www: Flags [.], ack 1032, win 2048, options [nop,nop,TS val 145475469 ecr 3729072747], length 0
13:01:11.898873 IP ip-192-168-1-10.us-west-2.compute.internal.50619 > 72.21.91.29.www: Flags [.], ack 1033, win 2048, options [nop,nop,TS val 145475469 ecr 3729072747], length 0
13:01:11.899441 IP ip-192-168-1-10.us-west-2.compute.internal.50619 > 72.21.91.29.www: Flags [F.], seq 261, ack 1033, win 2048, options [nop,nop,TS val 145475470 ecr 3729072747], length 0
13:01:11.912045 IP 72.21.91.29.www > ip-192-168-1-10.us-west-2.compute.internal.50619: Flags [.], ack 262, win 219, options [nop,nop,TS val 3729072764 ecr 145475470], length 0
13:01:11.915219 IP ip-192-168-1-10.us-west-2.compute.internal.50618 > a23-35-96-63.deploy.static.akamaitechnologies.com.https: Flags [P.], seq 241:367, ack 6041, win 2048, options [nop,nop,TS val 145475483 ecr 327931914], length 126
13:01:11.931662 IP a23-35-96-63.deploy.static.akamaitechnologies.com.https > ip-192-168-1-10.us-west-2.compute.internal.50618: Flags [P.], seq 6041:6092, ack 367, win 235, options [nop,nop,TS val 327932015 ecr 145475483], length 51
13:01:11.940487 IP ip-192-168-1-10.us-west-2.compute.internal.50618 > a23-35-96-63.deploy.static.akamaitechnologies.com.https: Flags [.], ack 6092, win 2047, options [nop,nop,TS val 145475508 ecr 327932015], length 0
13:01:11.954352 IP ip-192-168-1-10.us-west-2.compute.internal.50618 > a23-35-96-63.deploy.static.akamaitechnologies.com.https: Flags [P.], seq 367:420, ack 6092, win 2048, options [nop,nop,TS val 145475520 ecr 327932015], length 53
13:01:11.954371 IP ip-192-168-1-10.us-west-2.compute.internal.50618 > a23-35-96-63.deploy.static.akamaitechnologies.com.https: Flags [P.], seq 420:470, ack 6092, win 2048, options [nop,nop,TS val 145475520 ecr 327932015], length 50
13:01:11.954380 IP ip-192-168-1-10.us-west-2.compute.internal.50618 > a23-35-96-63.deploy.static.akamaitechnologies.com.https: Flags [P.], seq 470:512, ack 6092, win 2048, options [nop,nop,TS val 145475520 ecr 327932015], length 42
13:01:11.954400 IP ip-192-168-1-10.us-west-2.compute.internal.50618 > a23-35-96-63.deploy.static.akamaitechnologies.com.https: Flags [P.], seq 512:1164, ack 6092, win 2048, options [nop,nop,TS val 145475520 ecr 327932015], length 652
13:01:11.970525 IP a23-35-96-63.deploy.static.akamaitechnologies.com.https > ip-192-168-1-10.us-west-2.compute.internal.50618: Flags [.], ack 470, win 235, options [nop,nop,TS val 327932054 ecr 145475520], length 0
13:01:11.970726 IP a23-35-96-63.deploy.static.akamaitechnologies.com.https > ip-192-168-1-10.us-west-2.compute.internal.50618: Flags [P.], seq 6092:6169, ack 512, win 235, options [nop,nop,TS val 327932054 ecr 145475520], length 77
13:01:11.973627 IP ip-192-168-1-10.us-west-2.compute.internal.50618 > a23-35-96-63.deploy.static.akamaitechnologies.com.https: Flags [.], ack 6169, win 2046, options [nop,nop,TS val 145475538 ecr 327932054], length 0
13:01:11.973654 IP ip-192-168-1-10.us-west-2.compute.internal.50618 > a23-35-96-63.deploy.static.akamaitechnologies.com.https: Flags [P.], seq 1164:1202, ack 6169, win 2048, options [nop,nop,TS val 145475538 ecr 327932054], length 38
13:01:11.989844 IP a23-35-96-63.deploy.static.akamaitechnologies.com.https > ip-192-168-1-10.us-west-2.compute.internal.50618: Flags [.], ack 1202, win 245, options [nop,nop,TS val 327932074 ecr 145475520], length 0
13:01:12.126581 IP a23-35-96-63.deploy.static.akamaitechnologies.com.https > ip-192-168-1-10.us-west-2.compute.internal.50618: Flags [P.], seq 6169:7222, ack 1202, win 245, options [nop,nop,TS val 327932210 ecr 145475520], length 1053
13:01:12.126822 IP a23-35-96-63.deploy.static.akamaitechnologies.com.https > ip-192-168-1-10.us-west-2.compute.internal.50618: Flags [P.], seq 7222:7705, ack 1202, win 245, options [nop,nop,TS val 327932210 ecr 145475520], length 483
13:01:12.127104 IP a23-35-96-63.deploy.static.akamaitechnologies.com.https > ip-192-168-1-10.us-west-2.compute.internal.50618: Flags [P.], seq 7705:8758, ack 1202, win 245, options [nop,nop,TS val 327932211 ecr 145475520], length 1053
13:01:12.127296 IP a23-35-96-63.deploy.static.akamaitechnologies.com.https > ip-192-168-1-10.us-west-2.compute.internal.50618: Flags [P.], seq 8758:9811, ack 1202, win 245, options [nop,nop,TS val 327932211 ecr 145475520], length 1053
13:01:12.128050 IP a23-35-96-63.deploy.static.akamaitechnologies.com.https > ip-192-168-1-10.us-west-2.compute.internal.50618: Flags [.], seq 9811:11159, ack 1202, win 245, options [nop,nop,TS val 327932211 ecr 145475520], length 1348
13:01:12.128144 IP a23-35-96-63.deploy.static.akamaitechnologies.com.https > ip-192-168-1-10.us-west-2.compute.internal.50618: Flags [P.], seq 11159:11917, ack 1202, win 245, options [nop,nop,TS val 327932211 ecr 145475520], length 758
13:01:12.128715 IP ip-192-168-1-10.us-west-2.compute.internal.50618 > a23-35-96-63.deploy.static.akamaitechnologies.com.https: Flags [.], ack 7222, win 2031, options [nop,nop,TS val 145475676 ecr 327932210], length 0
13:01:12.128743 IP ip-192-168-1-10.us-west-2.compute.internal.50618 > a23-35-96-63.deploy.static.akamaitechnologies.com.https: Flags [.], ack 7705, win 2024, options [nop,nop,TS val 145475676 ecr 327932210], length 0
13:01:12.129542 IP a23-35-96-63.deploy.static.akamaitechnologies.com.https > ip-192-168-1-10.us-west-2.compute.internal.50618: Flags [.], seq 11917:13265, ack 1202, win 245, options [nop,nop,TS val 327932211 ecr 145475520], length 1348
13:01:12.129649 IP a23-35-96-63.deploy.static.akamaitechnologies.com.https > ip-192-168-1-10.us-west-2.compute.internal.50618: Flags [.], seq 13265:14613, ack 1202, win 245, options [nop,nop,TS val 327932211 ecr 145475520], length 1348
13:01:12.129687 IP a23-35-96-63.deploy.static.akamaitechnologies.com.https > ip-192-168-1-10.us-west-2.compute.internal.50618: Flags [.], seq 14613:15961, ack 1202, win 245, options [nop,nop,TS val 327932211 ecr 145475520], length 1348
13:01:12.129721 IP a23-35-96-63.deploy.static.akamaitechnologies.com.https > ip-192-168-1-10.us-west-2.compute.internal.50618: Flags [.], seq 15961:17309, ack 1202, win 245, options [nop,nop,TS val 327932211 ecr 145475520], length 1348
13:01:12.129770 IP a23-35-96-63.deploy.static.akamaitechnologies.com.https > ip-192-168-1-10.us-west-2.compute.internal.50618: Flags [.], seq 17309:18657, ack 1202, win 245, options [nop,nop,TS val 327932211 ecr 145475520], length 1348
13:01:12.129789 IP a23-35-96-63.deploy.static.akamaitechnologies.com.https > ip-192-168-1-10.us-west-2.compute.internal.50618: Flags [.], seq 18657:20005, ack 1202, win 245, options [nop,nop,TS val 327932211 ecr 145475520], length 1348
13:01:12.129800 IP a23-35-96-63.deploy.static.akamaitechnologies.com.https > ip-192-168-1-10.us-west-2.compute.internal.50618: Flags [.], seq 20005:21353, ack 1202, win 245, options [nop,nop,TS val 327932211 ecr 145475520], length 1348
13:01:12.129812 IP a23-35-96-63.deploy.static.akamaitechnologies.com.https > ip-192-168-1-10.us-west-2.compute.internal.50618: Flags [.], seq 21353:22701, ack 1202, win 245, options [nop,nop,TS val 327932211 ecr 145475520], length 1348
13:01:12.129825 IP a23-35-96-63.deploy.static.akamaitechnologies.com.https > ip-192-168-1-10.us-west-2.compute.internal.50618: Flags [.], seq 22701:24049, ack 1202, win 245, options [nop,nop,TS val 327932211 ecr 145475520], length 1348
13:01:12.129836 IP a23-35-96-63.deploy.static.akamaitechnologies.com.https > ip-192-168-1-10.us-west-2.compute.internal.50618: Flags [.], seq 24049:25397, ack 1202, win 245, options [nop,nop,TS val 327932211 ecr 145475520], length 1348
13:01:12.130029 IP ip-192-168-1-10.us-west-2.compute.internal.50618 > a23-35-96-63.deploy.static.akamaitechnologies.com.https: Flags [.], ack 8758, win 2031, options [nop,nop,TS val 145475676 ecr 327932211], length 0
13:01:12.130058 IP ip-192-168-1-10.us-west-2.compute.internal.50618 > a23-35-96-63.deploy.static.akamaitechnologies.com.https: Flags [.], ack 9811, win 2015, options [nop,nop,TS val 145475676 ecr 327932211], length 0
13:01:12.132746 IP ip-192-168-1-10.us-west-2.compute.internal.50618 > a23-35-96-63.deploy.static.akamaitechnologies.com.https: Flags [.], ack 11917, win 2015, options [nop,nop,TS val 145475677 ecr 327932211], length 0
13:01:12.132764 IP ip-192-168-1-10.us-west-2.compute.internal.50618 > a23-35-96-63.deploy.static.akamaitechnologies.com.https: Flags [.], ack 14613, win 2005, options [nop,nop,TS val 145475678 ecr 327932211], length 0
13:01:12.132783 IP ip-192-168-1-10.us-west-2.compute.internal.50618 > a23-35-96-63.deploy.static.akamaitechnologies.com.https: Flags [.], ack 17309, win 1963, options [nop,nop,TS val 145475678 ecr 327932211], length 0
13:01:12.138534 IP ip-192-168-1-10.us-west-2.compute.internal.50618 > a23-35-96-63.deploy.static.akamaitechnologies.com.https: Flags [.], ack 20005, win 1921, options [nop,nop,TS val 145475679 ecr 327932211], length 0
13:01:12.138561 IP ip-192-168-1-10.us-west-2.compute.internal.50618 > a23-35-96-63.deploy.static.akamaitechnologies.com.https: Flags [.], ack 22701, win 1879, options [nop,nop,TS val 145475679 ecr 327932211], length 0
13:01:12.138919 IP ip-192-168-1-10.us-west-2.compute.internal.50618 > a23-35-96-63.deploy.static.akamaitechnologies.com.https: Flags [.], ack 25397, win 1837, options [nop,nop,TS val 145475679 ecr 327932211], length 0
13:01:12.138941 IP ip-192-168-1-10.us-west-2.compute.internal.50618 > a23-35-96-63.deploy.static.akamaitechnologies.com.https: Flags [.], ack 25397, win 2048, options [nop,nop,TS val 145475680 ecr 327932211], length 0
13:01:12.145156 IP a23-35-96-63.deploy.static.akamaitechnologies.com.https > ip-192-168-1-10.us-west-2.compute.internal.50618: Flags [.], seq 25397:26745, ack 1202, win 245, options [nop,nop,TS val 327932229 ecr 145475676], length 1348
13:01:12.145338 IP a23-35-96-63.deploy.static.akamaitechnologies.com.https > ip-192-168-1-10.us-west-2.compute.internal.50618: Flags [.], seq 26745:28093, ack 1202, win 245, options [nop,nop,TS val 327932229 ecr 145475676], length 1348
13:01:12.145920 IP a23-35-96-63.deploy.static.akamaitechnologies.com.https > ip-192-168-1-10.us-west-2.compute.internal.50618: Flags [.], seq 28093:29441, ack 1202, win 245, options [nop,nop,TS val 327932229 ecr 145475676], length 1348
13:01:12.146032 IP a23-35-96-63.deploy.static.akamaitechnologies.com.https > ip-192-168-1-10.us-west-2.compute.internal.50618: Flags [.], seq 29441:30789, ack 1202, win 245, options [nop,nop,TS val 327932229 ecr 145475676], length 1348
13:01:12.147683 IP a23-35-96-63.deploy.static.akamaitechnologies.com.https > ip-192-168-1-10.us-west-2.compute.internal.50618: Flags [.], seq 30789:32137, ack 1202, win 245, options [nop,nop,TS val 327932230 ecr 145475676], length 1348
13:01:12.147817 IP a23-35-96-63.deploy.static.akamaitechnologies.com.https > ip-192-168-1-10.us-west-2.compute.internal.50618: Flags [.], seq 32137:33485, ack 1202, win 245, options [nop,nop,TS val 327932230 ecr 145475676], length 1348
13:01:12.147858 IP a23-35-96-63.deploy.static.akamaitechnologies.com.https > ip-192-168-1-10.us-west-2.compute.internal.50618: Flags [P.], seq 33485:34204, ack 1202, win 245, options [nop,nop,TS val 327932230 ecr 145475676], length 719
13:01:12.147952 IP ip-192-168-1-10.us-west-2.compute.internal.50618 > a23-35-96-63.deploy.static.akamaitechnologies.com.https: Flags [.], ack 28093, win 2005, options [nop,nop,TS val 145475691 ecr 327932229], length 0
13:01:12.148095 IP ip-192-168-1-10.us-west-2.compute.internal.50618 > a23-35-96-63.deploy.static.akamaitechnologies.com.https: Flags [.], ack 28093, win 2048, options [nop,nop,TS val 145475691 ecr 327932229], length 0
13:01:12.148558 IP ip-192-168-1-10.us-west-2.compute.internal.50618 > a23-35-96-63.deploy.static.akamaitechnologies.com.https: Flags [.], ack 30789, win 2026, options [nop,nop,TS val 145475691 ecr 327932229], length 0
13:01:12.150285 IP ip-192-168-1-10.us-west-2.compute.internal.50618 > a23-35-96-63.deploy.static.akamaitechnologies.com.https: Flags [.], ack 33485, win 2005, options [nop,nop,TS val 145475693 ecr 327932230], length 0
13:01:12.150301 IP ip-192-168-1-10.us-west-2.compute.internal.50618 > a23-35-96-63.deploy.static.akamaitechnologies.com.https: Flags [.], ack 34204, win 1994, options [nop,nop,TS val 145475693 ecr 327932230], length 0
13:01:12.150321 IP ip-192-168-1-10.us-west-2.compute.internal.50618 > a23-35-96-63.deploy.static.akamaitechnologies.com.https: Flags [.], ack 34204, win 2048, options [nop,nop,TS val 145475693 ecr 327932230], length 0
13:01:12.213384 IP ip-192-168-1-10.us-west-2.compute.internal.50620 > a23-35-96-63.deploy.static.akamaitechnologies.com.https: Flags [SEW], seq 1063065992, win 65535, options [mss 1460,nop,wscale 6,nop,nop,TS val 145475750 ecr 0,sackOK,eol], length 0
13:01:12.228022 IP a23-35-96-63.deploy.static.akamaitechnologies.com.https > ip-192-168-1-10.us-west-2.compute.internal.50620: Flags [S.], seq 3226292386, ack 1063065993, win 28960, options [mss 1360,sackOK,TS val 327932313 ecr 145475750,nop,wscale 7], length 0
13:01:12.229629 IP ip-192-168-1-10.us-west-2.compute.internal.50620 > a23-35-96-63.deploy.static.akamaitechnologies.com.https: Flags [.], ack 1, win 2064, options [nop,nop,TS val 145475764 ecr 327932313], length 0
13:01:12.231889 IP ip-192-168-1-10.us-west-2.compute.internal.50620 > a23-35-96-63.deploy.static.akamaitechnologies.com.https: Flags [P.], seq 1:241, ack 1, win 2064, options [nop,nop,TS val 145475764 ecr 327932313], length 240
13:01:12.245948 IP a23-35-96-63.deploy.static.akamaitechnologies.com.https > ip-192-168-1-10.us-west-2.compute.internal.50620: Flags [.], ack 241, win 235, options [nop,nop,TS val 327932331 ecr 145475764], length 0
13:01:12.246328 IP a23-35-96-63.deploy.static.akamaitechnologies.com.https > ip-192-168-1-10.us-west-2.compute.internal.50620: Flags [.], seq 1:1349, ack 241, win 235, options [nop,nop,TS val 327932331 ecr 145475764], length 1348
13:01:12.246388 IP a23-35-96-63.deploy.static.akamaitechnologies.com.https > ip-192-168-1-10.us-west-2.compute.internal.50620: Flags [.], seq 1349:2697, ack 241, win 235, options [nop,nop,TS val 327932331 ecr 145475764], length 1348
13:01:12.246419 IP a23-35-96-63.deploy.static.akamaitechnologies.com.https > ip-192-168-1-10.us-west-2.compute.internal.50620: Flags [.], seq 2697:4045, ack 241, win 235, options [nop,nop,TS val 327932331 ecr 145475764], length 1348
13:01:12.246448 IP a23-35-96-63.deploy.static.akamaitechnologies.com.https > ip-192-168-1-10.us-west-2.compute.internal.50620: Flags [P.], seq 4045:4097, ack 241, win 235, options [nop,nop,TS val 327932331 ecr 145475764], length 52
13:01:12.249844 IP ip-192-168-1-10.us-west-2.compute.internal.50620 > a23-35-96-63.deploy.static.akamaitechnologies.com.https: Flags [.], ack 2697, win 2022, options [nop,nop,TS val 145475781 ecr 327932331], length 0
13:01:12.249862 IP ip-192-168-1-10.us-west-2.compute.internal.50620 > a23-35-96-63.deploy.static.akamaitechnologies.com.https: Flags [.], ack 4097, win 2000, options [nop,nop,TS val 145475781 ecr 327932331], length 0
13:01:12.249885 IP ip-192-168-1-10.us-west-2.compute.internal.50620 > a23-35-96-63.deploy.static.akamaitechnologies.com.https: Flags [.], ack 4097, win 2048, options [nop,nop,TS val 145475781 ecr 327932331], length 0
13:01:12.264210 IP a23-35-96-63.deploy.static.akamaitechnologies.com.https > ip-192-168-1-10.us-west-2.compute.internal.50620: Flags [.], seq 4097:5445, ack 241, win 235, options [nop,nop,TS val 327932349 ecr 145475781], length 1348
13:01:12.264361 IP a23-35-96-63.deploy.static.akamaitechnologies.com.https > ip-192-168-1-10.us-west-2.compute.internal.50620: Flags [P.], seq 5445:6041, ack 241, win 235, options [nop,nop,TS val 327932349 ecr 145475781], length 596
13:01:12.267840 IP ip-192-168-1-10.us-west-2.compute.internal.50620 > a23-35-96-63.deploy.static.akamaitechnologies.com.https: Flags [.], ack 6041, win 2017, options [nop,nop,TS val 145475796 ecr 327932349], length 0
13:01:12.302387 IP ip-192-168-1-10.us-west-2.compute.internal.50620 > a23-35-96-63.deploy.static.akamaitechnologies.com.https: Flags [P.], seq 241:367, ack 6041, win 2048, options [nop,nop,TS val 145475827 ecr 327932349], length 126
13:01:12.316764 IP a23-35-96-63.deploy.static.akamaitechnologies.com.https > ip-192-168-1-10.us-west-2.compute.internal.50620: Flags [P.], seq 6041:6092, ack 367, win 235, options [nop,nop,TS val 327932402 ecr 145475827], length 51
13:01:12.318333 IP ip-192-168-1-10.us-west-2.compute.internal.50620 > a23-35-96-63.deploy.static.akamaitechnologies.com.https: Flags [.], ack 6092, win 2047, options [nop,nop,TS val 145475843 ecr 327932402], length 0
13:01:12.321098 IP ip-192-168-1-10.us-west-2.compute.internal.50620 > a23-35-96-63.deploy.static.akamaitechnologies.com.https: Flags [P.], seq 367:420, ack 6092, win 2048, options [nop,nop,TS val 145475845 ecr 327932402], length 53
13:01:12.321942 IP ip-192-168-1-10.us-west-2.compute.internal.50620 > a23-35-96-63.deploy.static.akamaitechnologies.com.https: Flags [P.], seq 420:470, ack 6092, win 2048, options [nop,nop,TS val 145475845 ecr 327932402], length 50
13:01:12.321955 IP ip-192-168-1-10.us-west-2.compute.internal.50620 > a23-35-96-63.deploy.static.akamaitechnologies.com.https: Flags [P.], seq 470:512, ack 6092, win 2048, options [nop,nop,TS val 145475845 ecr 327932402], length 42
13:01:12.321970 IP ip-192-168-1-10.us-west-2.compute.internal.50620 > a23-35-96-63.deploy.static.akamaitechnologies.com.https: Flags [P.], seq 512:1159, ack 6092, win 2048, options [nop,nop,TS val 145475845 ecr 327932402], length 647
13:01:12.335291 IP a23-35-96-63.deploy.static.akamaitechnologies.com.https > ip-192-168-1-10.us-west-2.compute.internal.50620: Flags [P.], seq 6092:6160, ack 420, win 235, options [nop,nop,TS val 327932420 ecr 145475845], length 68
13:01:12.335985 IP a23-35-96-63.deploy.static.akamaitechnologies.com.https > ip-192-168-1-10.us-west-2.compute.internal.50620: Flags [.], ack 1159, win 245, options [nop,nop,TS val 327932421 ecr 145475845], length 0
13:01:12.336105 IP a23-35-96-63.deploy.static.akamaitechnologies.com.https > ip-192-168-1-10.us-west-2.compute.internal.50620: Flags [P.], seq 6160:6198, ack 1159, win 245, options [nop,nop,TS val 327932421 ecr 145475845], length 38
13:01:12.336956 IP ip-192-168-1-10.us-west-2.compute.internal.50620 > a23-35-96-63.deploy.static.akamaitechnologies.com.https: Flags [.], ack 6160, win 2046, options [nop,nop,TS val 145475859 ecr 327932420], length 0
13:01:12.337313 IP ip-192-168-1-10.us-west-2.compute.internal.50620 > a23-35-96-63.deploy.static.akamaitechnologies.com.https: Flags [P.], seq 1159:1197, ack 6160, win 2048, options [nop,nop,TS val 145475859 ecr 327932420], length 38
13:01:12.341919 IP ip-192-168-1-10.us-west-2.compute.internal.50620 > a23-35-96-63.deploy.static.akamaitechnologies.com.https: Flags [.], ack 6198, win 2047, options [nop,nop,TS val 145475859 ecr 327932421], length 0
13:01:12.383494 IP ip-192-168-1-10.us-west-2.compute.internal.50620 > a23-35-96-63.deploy.static.akamaitechnologies.com.https: Flags [P.], seq 1159:1197, ack 6198, win 2048, options [nop,nop,TS val 145475905 ecr 327932421], length 38
13:01:12.392263 IP a23-35-96-63.deploy.static.akamaitechnologies.com.https > ip-192-168-1-10.us-west-2.compute.internal.50620: Flags [.], ack 1197, win 245, options [nop,nop,TS val 327932477 ecr 145475859], length 0
13:01:12.397446 IP a23-35-96-63.deploy.static.akamaitechnologies.com.https > ip-192-168-1-10.us-west-2.compute.internal.50620: Flags [.], ack 1197, win 245, options [nop,nop,TS val 327932482 ecr 145475905,nop,nop,sack 1 {1159:1197}], length 0
13:01:12.440739 IP a23-35-96-63.deploy.static.akamaitechnologies.com.https > ip-192-168-1-10.us-west-2.compute.internal.50620: Flags [P.], seq 6198:7251, ack 1197, win 245, options [nop,nop,TS val 327932526 ecr 145475905], length 1053
13:01:12.440915 IP a23-35-96-63.deploy.static.akamaitechnologies.com.https > ip-192-168-1-10.us-west-2.compute.internal.50620: Flags [P.], seq 7251:7735, ack 1197, win 245, options [nop,nop,TS val 327932526 ecr 145475905], length 484
13:01:12.441030 IP a23-35-96-63.deploy.static.akamaitechnologies.com.https > ip-192-168-1-10.us-west-2.compute.internal.50620: Flags [P.], seq 7735:8471, ack 1197, win 245, options [nop,nop,TS val 327932526 ecr 145475905], length 736
13:01:12.441327 IP a23-35-96-63.deploy.static.akamaitechnologies.com.https > ip-192-168-1-10.us-west-2.compute.internal.50620: Flags [P.], seq 8471:9524, ack 1197, win 245, options [nop,nop,TS val 327932526 ecr 145475905], length 1053
13:01:12.441957 IP a23-35-96-63.deploy.static.akamaitechnologies.com.https > ip-192-168-1-10.us-west-2.compute.internal.50620: Flags [P.], seq 9524:10577, ack 1197, win 245, options [nop,nop,TS val 327932526 ecr 145475905], length 1053
13:01:12.442661 IP a23-35-96-63.deploy.static.akamaitechnologies.com.https > ip-192-168-1-10.us-west-2.compute.internal.50620: Flags [.], seq 10577:11925, ack 1197, win 245, options [nop,nop,TS val 327932526 ecr 145475905], length 1348
13:01:12.442703 IP a23-35-96-63.deploy.static.akamaitechnologies.com.https > ip-192-168-1-10.us-west-2.compute.internal.50620: Flags [P.], seq 11925:12683, ack 1197, win 245, options [nop,nop,TS val 327932526 ecr 145475905], length 758
13:01:12.444020 IP a23-35-96-63.deploy.static.akamaitechnologies.com.https > ip-192-168-1-10.us-west-2.compute.internal.50620: Flags [.], seq 12683:14031, ack 1197, win 245, options [nop,nop,TS val 327932526 ecr 145475905], length 1348
13:01:12.444055 IP a23-35-96-63.deploy.static.akamaitechnologies.com.https > ip-192-168-1-10.us-west-2.compute.internal.50620: Flags [.], seq 14031:15379, ack 1197, win 245, options [nop,nop,TS val 327932526 ecr 145475905], length 1348
13:01:12.444081 IP a23-35-96-63.deploy.static.akamaitechnologies.com.https > ip-192-168-1-10.us-west-2.compute.internal.50620: Flags [.], seq 15379:16727, ack 1197, win 245, options [nop,nop,TS val 327932526 ecr 145475905], length 1348
13:01:12.444110 IP a23-35-96-63.deploy.static.akamaitechnologies.com.https > ip-192-168-1-10.us-west-2.compute.internal.50620: Flags [P.], seq 16727:16895, ack 1197, win 245, options [nop,nop,TS val 327932526 ecr 145475905], length 168
13:01:12.446774 IP a23-35-96-63.deploy.static.akamaitechnologies.com.https > ip-192-168-1-10.us-west-2.compute.internal.50620: Flags [.], seq 16895:18243, ack 1197, win 245, options [nop,nop,TS val 327932526 ecr 145475905], length 1348
13:01:12.446841 IP a23-35-96-63.deploy.static.akamaitechnologies.com.https > ip-192-168-1-10.us-west-2.compute.internal.50620: Flags [.], seq 18243:19591, ack 1197, win 245, options [nop,nop,TS val 327932526 ecr 145475905], length 1348
13:01:12.446868 IP a23-35-96-63.deploy.static.akamaitechnologies.com.https > ip-192-168-1-10.us-west-2.compute.internal.50620: Flags [.], seq 19591:20939, ack 1197, win 245, options [nop,nop,TS val 327932526 ecr 145475905], length 1348
13:01:12.446895 IP a23-35-96-63.deploy.static.akamaitechnologies.com.https > ip-192-168-1-10.us-west-2.compute.internal.50620: Flags [P.], seq 20939:21378, ack 1197, win 245, options [nop,nop,TS val 327932526 ecr 145475905], length 439
13:01:12.449640 IP a23-35-96-63.deploy.static.akamaitechnologies.com.https > ip-192-168-1-10.us-west-2.compute.internal.50620: Flags [P.], seq 21378:22431, ack 1197, win 245, options [nop,nop,TS val 327932526 ecr 145475905], length 1053
13:01:12.454496 IP ip-192-168-1-10.us-west-2.compute.internal.50620 > a23-35-96-63.deploy.static.akamaitechnologies.com.https: Flags [.], ack 7251, win 2031, options [nop,nop,TS val 145475972 ecr 327932526], length 0
13:01:12.454512 IP ip-192-168-1-10.us-west-2.compute.internal.50620 > a23-35-96-63.deploy.static.akamaitechnologies.com.https: Flags [.], ack 7735, win 2023, options [nop,nop,TS val 145475972 ecr 327932526], length 0
13:01:12.454521 IP ip-192-168-1-10.us-west-2.compute.internal.50620 > a23-35-96-63.deploy.static.akamaitechnologies.com.https: Flags [.], ack 8471, win 2012, options [nop,nop,TS val 145475972 ecr 327932526], length 0
13:01:12.454532 IP ip-192-168-1-10.us-west-2.compute.internal.50620 > a23-35-96-63.deploy.static.akamaitechnologies.com.https: Flags [.], ack 9524, win 2031, options [nop,nop,TS val 145475972 ecr 327932526], length 0
13:01:12.454542 IP ip-192-168-1-10.us-west-2.compute.internal.50620 > a23-35-96-63.deploy.static.akamaitechnologies.com.https: Flags [.], ack 10577, win 2015, options [nop,nop,TS val 145475972 ecr 327932526], length 0
13:01:12.454560 IP ip-192-168-1-10.us-west-2.compute.internal.50620 > a23-35-96-63.deploy.static.akamaitechnologies.com.https: Flags [.], ack 12683, win 2015, options [nop,nop,TS val 145475972 ecr 327932526], length 0
13:01:12.455030 IP ip-192-168-1-10.us-west-2.compute.internal.50620 > a23-35-96-63.deploy.static.akamaitechnologies.com.https: Flags [.], ack 15379, win 2005, options [nop,nop,TS val 145475972 ecr 327932526], length 0
13:01:12.455051 IP ip-192-168-1-10.us-west-2.compute.internal.50620 > a23-35-96-63.deploy.static.akamaitechnologies.com.https: Flags [.], ack 15379, win 2048, options [nop,nop,TS val 145475973 ecr 327932526], length 0
13:01:12.455062 IP ip-192-168-1-10.us-west-2.compute.internal.50620 > a23-35-96-63.deploy.static.akamaitechnologies.com.https: Flags [.], ack 16895, win 2024, options [nop,nop,TS val 145475973 ecr 327932526], length 0
13:01:12.455071 IP ip-192-168-1-10.us-west-2.compute.internal.50620 > a23-35-96-63.deploy.static.akamaitechnologies.com.https: Flags [.], ack 19591, win 1982, options [nop,nop,TS val 145475973 ecr 327932526], length 0
13:01:12.455085 IP ip-192-168-1-10.us-west-2.compute.internal.50620 > a23-35-96-63.deploy.static.akamaitechnologies.com.https: Flags [.], ack 19591, win 2048, options [nop,nop,TS val 145475973 ecr 327932526], length 0
13:01:12.455848 IP ip-192-168-1-10.us-west-2.compute.internal.50620 > a23-35-96-63.deploy.static.akamaitechnologies.com.https: Flags [.], ack 21378, win 2020, options [nop,nop,TS val 145475973 ecr 327932526], length 0
13:01:12.455861 IP ip-192-168-1-10.us-west-2.compute.internal.50620 > a23-35-96-63.deploy.static.akamaitechnologies.com.https: Flags [.], ack 22431, win 2003, options [nop,nop,TS val 145475973 ecr 327932526], length 0
13:01:12.455875 IP ip-192-168-1-10.us-west-2.compute.internal.50620 > a23-35-96-63.deploy.static.akamaitechnologies.com.https: Flags [.], ack 22431, win 2048, options [nop,nop,TS val 145475973 ecr 327932526], length 0
13:01:12.468769 IP a23-35-96-63.deploy.static.akamaitechnologies.com.https > ip-192-168-1-10.us-west-2.compute.internal.50620: Flags [.], seq 22431:23779, ack 1197, win 245, options [nop,nop,TS val 327932553 ecr 145475972], length 1348
13:01:12.468876 IP a23-35-96-63.deploy.static.akamaitechnologies.com.https > ip-192-168-1-10.us-west-2.compute.internal.50620: Flags [.], seq 23779:25127, ack 1197, win 245, options [nop,nop,TS val 327932553 ecr 145475972], length 1348
13:01:12.469552 IP a23-35-96-63.deploy.static.akamaitechnologies.com.https > ip-192-168-1-10.us-west-2.compute.internal.50620: Flags [.], seq 25127:26475, ack 1197, win 245, options [nop,nop,TS val 327932554 ecr 145475972], length 1348
13:01:12.469612 IP a23-35-96-63.deploy.static.akamaitechnologies.com.https > ip-192-168-1-10.us-west-2.compute.internal.50620: Flags [.], seq 26475:27823, ack 1197, win 245, options [nop,nop,TS val 327932554 ecr 145475972], length 1348
13:01:12.469643 IP a23-35-96-63.deploy.static.akamaitechnologies.com.https > ip-192-168-1-10.us-west-2.compute.internal.50620: Flags [.], seq 27823:29171, ack 1197, win 245, options [nop,nop,TS val 327932554 ecr 145475972], length 1348
13:01:12.469672 IP a23-35-96-63.deploy.static.akamaitechnologies.com.https > ip-192-168-1-10.us-west-2.compute.internal.50620: Flags [.], seq 29171:30519, ack 1197, win 245, options [nop,nop,TS val 327932554 ecr 145475972], length 1348
13:01:12.469699 IP a23-35-96-63.deploy.static.akamaitechnologies.com.https > ip-192-168-1-10.us-west-2.compute.internal.50620: Flags [.